{
  "$schema": "http://json-schema.org/draft-07/schema#",
  "title": "SFL Manifest",
  "description": "Tracks which Set it Free Loop components are deployed to a consumer repository and at what version.",
  "type": "object",
  "required": ["version", "deployedAt", "tier", "source", "components"],
  "properties": {
    "version": {
      "type": "string",
      "description": "The SFL semantic version that was deployed (for example, '2.0.0' or '2.1.0-rc.1').",
      "pattern": "^(0|[1-9]\\d*)\\.(0|[1-9]\\d*)\\.(0|[1-9]\\d*)(?:-((?:0|[1-9]\\d*|[0-9A-Za-z-]*[A-Za-z-][0-9A-Za-z-]*)(?:\\.(?:0|[1-9]\\d*|[0-9A-Za-z-]*[A-Za-z-][0-9A-Za-z-]*))*))?(?:\\+([0-9A-Za-z-]+(?:\\.[0-9A-Za-z-]+)*))?$"
    },
    "deployedAt": {
      "type": "string",
      "format": "date-time",
      "description": "ISO 8601 timestamp of when the deployment was performed."
    },
    "tier": {
      "type": "string",
      "enum": ["reviewer", "review", "minimal", "standard", "full", "custom"],
      "description": "The deployment tier selected during installation."
    },
    "source": {
      "type": "string",
      "description": "The source repository in org/repo format.",
      "default": "HemSoft/set-it-free-loop"
    },
    "sourceSha": {
      "type": "string",
      "description": "The git SHA of the source repo at deployment time. Use 'self' when the SFL repo dogfoods its own loop.",
      "pattern": "^([0-9a-f]{40}|self)$"
    },
    "deployedBy": {
      "type": "string",
      "description": "GitHub login that initiated the deployment."
    },
    "addons": {
      "type": "array",
      "items": {
        "type": "string"
      },
      "uniqueItems": true,
      "description": "Optional SFL add-ons included in the deployment."
    },
    "components": {
      "type": "array",
      "items": {
        "type": "string",
        "enum": [
          "labels",
          "governance",
          "sfl-auditor",
          "sfl-dispatcher",
          "daily-repo-status",
          "repo-audit",
          "simplisticate",
          "issue-processor",
          "sfl-pr-review-auto",
          "pr-analyzer-general",
          "pr-analyzer-quality",
          "pr-analyzer-security",
          "pr-analyzer-testing",
          "pr-fixer",
          "pr-promoter"
        ]
      },
      "uniqueItems": true,
      "description": "List of deployed SFL components."
    },
    "enginePolicy": {
      "type": "object",
      "required": ["defaultProfile", "workflows"],
      "properties": {
        "defaultProfile": {
          "type": "string",
          "minLength": 1
        },
        "workflows": {
          "type": "array",
          "items": {
            "type": "object",
            "required": ["name", "profile", "provider", "model", "renderedModel"],
            "properties": {
              "name": {
                "type": "string",
                "minLength": 1
              },
              "profile": {
                "type": "string",
                "minLength": 1
              },
              "provider": {
                "type": "string",
                "enum": ["copilot", "claude", "codex", "gemini", "crush", "opencode", "pi"]
              },
              "model": {
                "type": "string",
                "minLength": 1
              },
              "effort": {
                "type": ["string", "null"],
                "enum": ["low", "medium", "high", null]
              },
              "renderedModel": {
                "type": "string",
                "minLength": 1
              },
              "requiredSecretsAnyOf": {
                "type": "array",
                "items": {
                  "type": "string",
                  "minLength": 1
                },
                "uniqueItems": true
              },
              "arguments": {
                "type": "array",
                "items": {
                  "type": "string",
                  "minLength": 1
                }
              },
              "environment": {
                "type": ["object", "null"],
                "additionalProperties": {
                  "type": "string",
                  "minLength": 1
                }
              }
            },
            "additionalProperties": false
          }
        }
      },
      "additionalProperties": false,
      "description": "Resolved engine policy used when deploying workflow markdown."
    }
  },
  "additionalProperties": false
}
