{
  "version": "2.1.0-rc.29",
  "deployedAt": "2026-02-22T22:00:00Z",
  "tier": "full",
  "source": "hemsoft-dev/set-it-free-loop",
  "sourceSha": "self",
  "components": [
    "labels",
    "governance",
    "sfl-dispatcher",
    "sfl-auditor",
    "daily-repo-status",
    "repo-audit",
    "issue-processor",
    "simplisticate",
    "sfl-pr-review-auto",
    "pr-analyzer-general",
    "pr-analyzer-quality",
    "pr-analyzer-security",
    "pr-analyzer-testing",
    "pr-fixer",
    "pr-promoter"
  ],
  "enginePolicy": {
    "defaultProfile": "codex-gpt-55-high",
    "workflows": [
      {
        "name": "daily-repo-status",
        "profile": "codex-gpt-55-high",
        "provider": "codex",
        "model": "gpt-5.5",
        "effort": "high",
        "renderedModel": "gpt-5.5?effort=high",
        "requiredSecretsAnyOf": [
          "CODEX_API_KEY",
          "OPENAI_API_KEY"
        ]
      },
      {
        "name": "repo-audit",
        "profile": "codex-gpt-55-high",
        "provider": "codex",
        "model": "gpt-5.5",
        "effort": "high",
        "renderedModel": "gpt-5.5?effort=high",
        "requiredSecretsAnyOf": [
          "CODEX_API_KEY",
          "OPENAI_API_KEY"
        ]
      },
      {
        "name": "issue-processor",
        "profile": "codex-gpt-55-high",
        "provider": "codex",
        "model": "gpt-5.5",
        "effort": "high",
        "renderedModel": "gpt-5.5?effort=high",
        "requiredSecretsAnyOf": [
          "CODEX_API_KEY",
          "OPENAI_API_KEY"
        ]
      },
      {
        "name": "simplisticate",
        "profile": "codex-gpt-55-high",
        "provider": "codex",
        "model": "gpt-5.5",
        "effort": "high",
        "renderedModel": "gpt-5.5?effort=high",
        "requiredSecretsAnyOf": [
          "CODEX_API_KEY",
          "OPENAI_API_KEY"
        ]
      },
      {
        "name": "pr-analyzer-general",
        "profile": "codex-gpt-55-high",
        "provider": "codex",
        "model": "gpt-5.5",
        "effort": "high",
        "renderedModel": "gpt-5.5?effort=high",
        "requiredSecretsAnyOf": [
          "CODEX_API_KEY",
          "OPENAI_API_KEY"
        ]
      },
      {
        "name": "pr-analyzer-quality",
        "profile": "codex-gpt-55-high",
        "provider": "codex",
        "model": "gpt-5.5",
        "effort": "high",
        "renderedModel": "gpt-5.5?effort=high",
        "requiredSecretsAnyOf": [
          "CODEX_API_KEY",
          "OPENAI_API_KEY"
        ]
      },
      {
        "name": "pr-analyzer-security",
        "profile": "codex-gpt-55-high",
        "provider": "codex",
        "model": "gpt-5.5",
        "effort": "high",
        "renderedModel": "gpt-5.5?effort=high",
        "requiredSecretsAnyOf": [
          "CODEX_API_KEY",
          "OPENAI_API_KEY"
        ]
      },
      {
        "name": "pr-analyzer-testing",
        "profile": "codex-gpt-55-high",
        "provider": "codex",
        "model": "gpt-5.5",
        "effort": "high",
        "renderedModel": "gpt-5.5?effort=high",
        "requiredSecretsAnyOf": [
          "CODEX_API_KEY",
          "OPENAI_API_KEY"
        ]
      },
      {
        "name": "pr-fixer",
        "profile": "codex-gpt-55-high",
        "provider": "codex",
        "model": "gpt-5.5",
        "effort": "high",
        "renderedModel": "gpt-5.5?effort=high",
        "requiredSecretsAnyOf": [
          "CODEX_API_KEY",
          "OPENAI_API_KEY"
        ]
      },
      {
        "name": "pr-promoter",
        "profile": "codex-gpt-55-high",
        "provider": "codex",
        "model": "gpt-5.5",
        "effort": "high",
        "renderedModel": "gpt-5.5?effort=high",
        "requiredSecretsAnyOf": [
          "CODEX_API_KEY",
          "OPENAI_API_KEY"
        ]
      }
    ]
  }
}
